title,image,description
Washington 2024,https://raw.githubusercontent.com/CoolGamerTheSpy/CoolGamerTheSpy.github.io/main/TSA%20Pins%20Photos/Washington/2024.jpg,A beach with a starfish dangling off it.
Washington 2023,https://raw.githubusercontent.com/CoolGamerTheSpy/CoolGamerTheSpy.github.io/main/TSA%20Pins%20Photos/Washington/2023.jpg,A tower with a light on top.
Washington 2022,https://raw.githubusercontent.com/CoolGamerTheSpy/CoolGamerTheSpy.github.io/main/TSA%20Pins%20Photos/Washington/2022.jpg,"A otter holding a pearl laying on water. ""2022"" is written on a arch and both ""TSA"" and ""Washington"" are written on the water."
Washington 2021,https://raw.githubusercontent.com/CoolGamerTheSpy/CoolGamerTheSpy.github.io/main/TSA%20Pins%20Photos/Washington/2021.jpg,"WAsh your hands, with a 2020 but with a red one in the last 0."
Washington 2020,https://raw.githubusercontent.com/CoolGamerTheSpy/CoolGamerTheSpy.github.io/main/TSA%20Pins%20Photos/Washington/2020.jpg,An orca with seattle in the back.
Washington 2019,https://raw.githubusercontent.com/CoolGamerTheSpy/CoolGamerTheSpy.github.io/main/TSA%20Pins%20Photos/Washington/2019.jpg,A bird flying over a mountain.
Washington 2018,https://raw.githubusercontent.com/CoolGamerTheSpy/CoolGamerTheSpy.github.io/main/TSA%20Pins%20Photos/Washington/2018.jpg,An orca with seattle printed on it.
Washington 2017,https://raw.githubusercontent.com/CoolGamerTheSpy/CoolGamerTheSpy.github.io/main/TSA%20Pins%20Photos/Washington/2017.jpg,"TSA in red, white, and blue with the space needle in the back."
Washington 2016,https://raw.githubusercontent.com/CoolGamerTheSpy/CoolGamerTheSpy.github.io/main/TSA%20Pins%20Photos/Washington/2016.jpg,The shape of the state with iconic items and landmarks on it.
Washington 2015,https://raw.githubusercontent.com/CoolGamerTheSpy/CoolGamerTheSpy.github.io/main/TSA%20Pins%20Photos/Washington/2015.jpg,A yellow and dark-blue plane.
Washington 2014,https://raw.githubusercontent.com/CoolGamerTheSpy/CoolGamerTheSpy.github.io/main/TSA%20Pins%20Photos/Washington/2014.jpg,An orca with seattle in the back.
Washington 2013,https://raw.githubusercontent.com/CoolGamerTheSpy/CoolGamerTheSpy.github.io/main/TSA%20Pins%20Photos/Washington/2013.jpg,A water dropplet with a mountain in it.
Washington 2012,https://raw.githubusercontent.com/CoolGamerTheSpy/CoolGamerTheSpy.github.io/main/TSA%20Pins%20Photos/Washington/2012.jpg,Green with George Washington on it.
Washington 2011,https://raw.githubusercontent.com/CoolGamerTheSpy/CoolGamerTheSpy.github.io/main/TSA%20Pins%20Photos/Washington/2011.jpg,Blue with a plane and mountain.
Washington 2010,https://raw.githubusercontent.com/CoolGamerTheSpy/CoolGamerTheSpy.github.io/main/TSA%20Pins%20Photos/Washington/2010.jpg,A fish in Native American Art style.
Washington 2009,https://raw.githubusercontent.com/CoolGamerTheSpy/CoolGamerTheSpy.github.io/main/TSA%20Pins%20Photos/Washington/2009.jpg,A plane and boat passing Seattle.
Washington 2008,https://raw.githubusercontent.com/CoolGamerTheSpy/CoolGamerTheSpy.github.io/main/TSA%20Pins%20Photos/Washington/2008.jpg,State shape with a mountain in it.
Washington 2007,https://raw.githubusercontent.com/CoolGamerTheSpy/CoolGamerTheSpy.github.io/main/TSA%20Pins%20Photos/Washington/2007.jpg,Pine trees with the state on top of it.
Washington 2006,https://raw.githubusercontent.com/CoolGamerTheSpy/CoolGamerTheSpy.github.io/main/TSA%20Pins%20Photos/Washington/2006.jpg,An Apple with Seattle in it.
Washington 2005,https://raw.githubusercontent.com/CoolGamerTheSpy/CoolGamerTheSpy.github.io/main/TSA%20Pins%20Photos/Washington/2005.jpg,WTSA with the Space Needle 
Washington 2004,https://raw.githubusercontent.com/CoolGamerTheSpy/CoolGamerTheSpy.github.io/main/TSA%20Pins%20Photos/Washington/2004.jpg,State with an apple core on it.
Washington 2003,https://raw.githubusercontent.com/CoolGamerTheSpy/CoolGamerTheSpy.github.io/main/TSA%20Pins%20Photos/Washington/2003.jpg,Blue with the SuperMan symbol.